,topic,document
488,3_alaa_strike_prison_water,'s dark prison locked services left nothing mama ragia family friend remain officers well although n't appeared hours still waiting letter worrying top everything else
489,-1_climate_minister_world_president,tune tomorrow november th gmt watch opening ceremony live live stream 
490,3_alaa_strike_prison_water,modest suggestion make sure british citizen pro democracy activist alaa abd el fattah sisi 's dungeon reunited family london arrive wo n't hear end 
491,0_climate_must_change_world,globalist unelected pm squatting mandate n't 's spaffing millions money away cronies plebs '' look say f voted 
492,4_cop_today_due_work,kicks hours participate drive conversation climate related worktake stock discussed cop advocate key recommendations aligned au eu partnership
493,0_climate_must_change_world,nicola sturgeon devolved administrator her remit internal domestic matters seriously wtaf like sending joey essex nasas planetary mechanics convention 
494,3_alaa_strike_prison_water,alaa done wo n't go another year horrid nightmarehe wrote us starting tomorrow full hunger strike calorie intake whatsoeverstarting novemeber th go water strikeif n't resolve die
495,2_sheikh_sharm_el_summit,happening environment forestry cabinet secretary hon soipan tuya arrives united nations framework convention climate change unfccc cop sharm el sheikh egypt the cs currently attending africa group negotiators preparatory meeting
496,2_sheikh_sharm_el_summit,arrived live sharm el sheikh tune keep latest on ground action part conversations 
497,-1_climate_minister_world_president,look made blue zone despite governments best efforts thanks much helped
498,0_climate_must_change_world,powerful piece must mean africa climate action renewables luxury indivisible building peace security stability prosperity 
499,0_climate_must_change_world,must acknowledge harsh truth adapting growing number catastrophes causing enormous suffering around world deadly impacts longer swept rug sg 
500,0_climate_must_change_world,gore pedals line get net zero temperatures stop rising within little years '' misleading dangerous narrative ignores locked in warming need thermal mitigation 
501,0_climate_must_change_world,say scottish nationalists lack sense humour crack joke nippys expense like ill report police seriously lighten know got beat get
502,-1_climate_minister_world_president,'ve started work sharm el sheikh 'll spend november best advocate practical scalable solutions green jobs youth transition climate finance elevate young eastern european voices tough times let 's catch 
503,0_climate_must_change_world,face many challenges climate change biggest this implementation summit keep track promises we need everything keep degrees reach 
504,5_private_jets_cola_coca,jolly boys outing world leaders pretend climate emergency fly private jets tell us must fly less people going wake 
505,4_cop_today_due_work,heading along half plane ive since cop missed bali india cops due maternity leave kids grown emissions due working
506,0_climate_must_change_world,much costto send reluctant sunak foots bill attendance perhaps could investigate kay 
