,topic,document
326,0_climate_must_change_world,'re climate emergency 're staring catastrophe face sunak shirks real climate leaders keeping fossil fuels ground securing transition liveable future interview
327,3_alaa_strike_prison_water,sisis mouthpiece ahmed mousa says alaa abdelfattah political prisoner claims alaa kidnapped police officer took weapon responding international campaigns releasing alaa mousa says egypt n't accept international calls 
328,-1_climate_minister_world_president,kia ora friends youre heading today please show solidarity disabled chronically ill immunocompromised colleagues like wear highly rated mask throughout day keep us safe counting 
329,-1_climate_minister_world_president,panel mobilising finance climate health titled leaders lead moderated w h e prime minister barbados first minister scotland egyptian minister economic development
330,1_egypt_climate_crisis_russia,ca n't believe 'm attending egypt this first ever global '' assignment 'm thoroughly excited path science journalism taking hoping learn veterans tell africa 's stories hope face 
331,0_climate_must_change_world, companies make bn dollars profits last three months expect contribute least cents every dollar profit fund people expect '' world leaders summit 
332,-1_climate_minister_world_president,prime minister day leader devolved administration council leader tow days strange true
333,0_climate_must_change_world,year ago world leaders agreed phase '' coal since consumption set records 
334,-1_climate_minister_world_president,nepal one climate leaders south asia joined global methane pledge gmp climate clean air coalition ccac hope countries follow lead 
335,0_climate_must_change_world,children youth pavilion please visit explore first kind initiative heard voices children youth un climate summit 
336,-1_climate_minister_world_president,world 's lungs breathed sigh relief lula rt breathed sigh relief
337,0_climate_must_change_world,three points apocalyptics predicted snows kilimanjaro would disappear nope predicted glacier national park glaciers would gone nope nope alarmist prediction ever come true 
338,0_climate_must_change_world,start kicked annual festival takes people n't really think climate change problem eleventy hundredth time thread arguments reckless point genuinely dangerous 
339,4_cop_today_due_work,started exciting meet amazing learn incredible initiatives pavilion
340,0_climate_must_change_world,starts tomorrow govt must remember could cost bn year yet rich countries utterly failing pull weight must provide finance bring climate justiceme
341,0_climate_must_change_world,climate policy factbook w reveals g member countries increased support coal oil gas fossil fuel power ahead countries must held accountable commitment paris agreement 
342,-1_climate_minister_world_president,time last year one scientists arrested peaceful protest 's clip wet explaining reason took part action year later governments still failing
343,0_climate_must_change_world,new kerry says amlo soon make announcement presumably raising mexico 's climate goals spent great dealworking countriesto get raise ndcs major announcement president lpez obrador agreed
344,-1_climate_minister_world_president,made 'm keeping particularly close eye climate finance give shout want chat grab coffee come find gang office upper floor media centre
345,0_climate_must_change_world,climate nature two sides coin solve one without other at alongside continuing commitments deep cuts emissions countries put nature agendas together tackle reverse nature loss 
346,-1_climate_minister_world_president,melting pearl mountains 
347,0_climate_must_change_world,seems important wurrld leader missing great photo opportunity 
348,0_climate_must_change_world,two points 's warming years despite total emissions warmest 'modern times ' warm earlier like years ago coal plants suvs cheeseburgers climate hoax 
349,2_sheikh_sharm_el_summit,starting sunday hosting global climate summit since 
350,0_climate_must_change_world, analysis finds stopping expansion offshore drilling help prevent worst impacts climate crisis 
351,0_climate_must_change_world,finance vital hurricanes irma maria dominica cost countrys gdp crops destroyed grant shapps says uk agrees theres discussion had but need words finance needs table 
352,1_egypt_climate_crisis_russia,colleague working team trusted journalists lawyers scholars activists ground egypt collecting stories testimonies outside green bubble 
353,0_climate_must_change_world,countries serious climate actionthe would ban new oil gas coal drillingban fossil fuel subsidiesban deforestationban draining wetlandsban private jetsban new airports roads expansionsration air travel
354,0_climate_must_change_world,think climate emergency much emergency everybody seems think claire fox scientist could stopped think '' 
355,-1_climate_minister_world_president,charles grade a hypocrite environment represents worst polluters 's expert 's good advocate 's government official negotiate nations business going
356,0_climate_must_change_world,rishi sunak really need go world leader word frankly n't hear 
357,2_sheikh_sharm_el_summit,king hosted reception buckingham palace discuss tackling climate change global leaders prepare summit sharm el sheikh egypt 
358,0_climate_must_change_world, building progress made glasgow tackle climate crisis every country aligns commitments goal limiting warming c implement plans 
359,2_sheikh_sharm_el_summit,prime minister mohammad shahbaz sharif arrived sharm el sheikh egypt participate sharm el sheikh climate implementation summit ''
360,0_climate_must_change_world, together youth climate advocate germany climate crisis urgency taking 
361,0_climate_must_change_world,intervention causes affects rights millions people crisis requires every voice every effort every solution especially needs frontlines 
362,0_climate_must_change_world,planet telling us loudly clearly reached limit climate action must top global priority 
363,0_climate_must_change_world,remotely convinced sunak urging world leaders summon collective cap global rise temperatures didnt want go summit plans use half already reduced foreign aid budget home words vs actions times 
364,-1_climate_minister_world_president,many places earth every breath person takes polluted rt agree put end fossil fuel addiction 
365,-1_climate_minister_world_president,thinking starts stay strong dear one may never defeated 
366,0_climate_must_change_world,kind reminder world leaders conference promises this must conference commitments our children need climate justice 
367,0_climate_must_change_world,decarbonisation means phase out fossil fuels path actually succeed protecting climate communities opening press conference sharm el sheikh talks must strengthen references fossil fuels 
368,0_climate_must_change_world,young people moved front global agenda yesterday thanked youth delegates gathered sharm el sheikh hard work asked support aswe start pushing climate promises page action 
369,2_sheikh_sharm_el_summit,on site ready un climate conference sharm el sheikh egypt here 's everything need know
370,4_cop_today_due_work,proud security officers flew vienna sharm el sheikh contribute protection k in person particpants standing guard long hours ensure safety a big thank 
371,0_climate_must_change_world, longer horizon longer doorstep homes the world must urgent accelerated action stay tuned regular updates unep 
372,-1_climate_minister_world_president,sets milestone mobilizing funds pay equivalent one gigaton high quality emissions reductions yearly thereafter join us nov learn live link 
373,0_climate_must_change_world,despite goals set paris agreement support fossil fuels g nations reached highest level since ahead climate policy factbook outlines critical steps needed meet climate goals 
374,2_sheikh_sharm_el_summit,prime minister muhammad shehbaz sharif meets united nations secretary general h e antonio guterres sidelines cop 
375,0_climate_must_change_world,delighted attending completely agree comment long term prosperity without action climate change
376,2_sheikh_sharm_el_summit,prime minister shehbaz sharif left egypt participate sharm el sheikh climate implementation summit ''
377,2_sheikh_sharm_el_summit,un climate conference kick sharm el sheikh egypt every government every business every investor every institution everybody must commit much faster bolder protect planet future 
378,0_climate_must_change_world,rwanda climate change leader dedicated delivering ambitious climate commitments today met minster foreign affairs discuss helping gain access climate finance strengthen climate commitments 
379,0_climate_must_change_world,sunak asked johnsons presence said showed uks great commitment present past pm normal union equals would also included mention scotlands fm bring even 
380,3_alaa_strike_prison_water, overshadowed egyptian government 's imprisonment friend comrade alaa abd el fattah stopped drinking water part hunger strike son khaled dodo went sit in alaa aunt 
381,2_sheikh_sharm_el_summit,tomorrow eyes world sharm el sheikh kicks next two weeks world leaders negotiators come together ensure promises made glasgow cop kept built upon 
382,0_climate_must_change_world,decisions next two weeks define future humanity unprecedented action able change course crisis 
383,3_alaa_strike_prison_water,shattering news alaa either free next days die prison world watches family friends done everything possible work release hero jail sharing facebook post torture 
384,-1_climate_minister_world_president,beautiful amazing brother choice made moves forward knowing already battle irrespective written last page
385,-1_climate_minister_world_president,public private partnerships core effective response climate emergency official negotiations cop open door new business models economic incentives scientific innovations president kagame terra carta action forum
386,0_climate_must_change_world,ca n't researchers arsed brief ca n't arsed find question another wee pop elected head scotland 's government defined formal role 
387,0_climate_must_change_world,insouciant arrogance telling joe biden emmanuel macron busy pressing domestic issues ignores much needs get planet killing venal libertarian bastards office 
388,-1_climate_minister_world_president,commitment sustainability core purpose values want partner feel learn addressing urgent climate challenges delivering ambitions and ambitious
389,0_climate_must_change_world,finance agenda adopted without rich countries bullying poorer nations agree language protect historical polluters compensation liability nevertheless new chapter fight begins 
390,3_alaa_strike_prison_water, pm cairo time mama laila soueif still waiting since morning infront prison letter still sign anything could tell us fine hospitalised let alone alive wait pray
391,0_climate_must_change_world,finland important implementation paris agreement progresses decisions based recent scientific research pm delivered finland 's statement full text statement 
392,0_climate_must_change_world,boris johnson th holiday year finished already 
393,0_climate_must_change_world,rishi sunak attend cares environment tories bad things everyone notices 're forced u turn 
394,0_climate_must_change_world,hold hat theyve started climate change brainwashing new pandemic every day every tv station every radio station expect arguments friends family gon na tremendous bore
395,0_climate_must_change_world,stay course abroad we invest energies future work partners climate adaptation help restore forests we provide largest contribution climate finance billion 
396,0_climate_must_change_world,difference spent whole life trying save amazonian forest fight climate change whereas cant even bothered show face
397,0_climate_must_change_world,'s estimates billion people cities risk extreme heat food insecurity sea level rise poverty due impacts 's imperative countries work together drive
398,0_climate_must_change_world,guten morgen aus must everything ensure liveable future beautiful planet generations come 
399,-1_climate_minister_world_president,good hear attending need strong advocate show leadership vital role nature play dealing climate crisis pm also attend global nature summit montreal next month 
400,3_alaa_strike_prison_water,today going weekend visited sanaa sister alaa abd el fattah political prisoner hunger strike days egypt cop begins escalate water strike climate movement must stand solidarity
401,5_private_jets_cola_coca,voters stupidest mugs planet played gang gravy bus troughers quote
402,0_climate_must_change_world,nations come together cooperate theres always cause hope declares sunak unironically its many us hate brexit self harming isolationism 
403,1_egypt_climate_crisis_russia, one thing certain give sure lose lets fight together lets win egypt stresses human activity cause climate crisis also solution 
404,3_alaa_strike_prison_water, yet defeated '' sharing foreword alaa abd el fattah 's brilliant book wrote prison turns gave rallying cry 
405,0_climate_must_change_world,planet trouble looks like science undeniable time waste protect planet 
406,4_cop_today_due_work,friends cop advised written ministers today underlining importance attendance honouring commitments building solidarity trust drive recovery prosperity security inclusion
407,0_climate_must_change_world,fact countries least responsible climate change ones warming fastest children paying highest price developed countries must urgently deliver climate commitments expand funding climate adaptation 
408,0_climate_must_change_world,sad story need take action towards mitigation effects climate change
409,0_climate_must_change_world,good morning beautiful sunny whole world ready next weeks well finding solutions putting plans action future 
410,0_climate_must_change_world,world leaders talk warming climate talk affects mental health cope thursday th pm cet hosted
411,0_climate_must_change_world,sunak presumably told johnson staging photo opportunity outside 
412,3_alaa_strike_prison_water,climate justice nothing without racial social economic justice ahead govt must ensure release alaa abd el fattah british citizen father brother writer activist yrs unlawful imprisonment egyptme
413,0_climate_must_change_world,warning viable path left c climate target uganda risk investing loan nearly billion eacop climate bomb our economic devt clean possible maximumly efficient cut ghg emissions 
414,3_alaa_strike_prison_water,great work nail ex junkie psychopath dangerous deranged people need locking
415,2_sheikh_sharm_el_summit,prime minister shehbaz sharif met un secretary general sidelines cop summit held sharm el sheikh today 
416,4_cop_today_due_work,welcoming special way
417,0_climate_must_change_world,ever rising greenhouse gas emissions supercharging extreme weather events across planet at today un chief unveiled plan provide everyone earth early warnings extreme dangerous weather 
418,-1_climate_minister_world_president,gets underway starting pakistans first info series covering environment economics public policy around world works watch episodes
419,1_egypt_climate_crisis_russia,starts today egypt biden attending despite tough mid term attending xi putin modi 
420,0_climate_must_change_world,wonder many times 're going hear lie scotland produces almost electricity renewables fortnight leadership would taking opportunity spotlight correct record 
421,-1_climate_minister_world_president,fm joined prime minister barbados dr hala el said panel discussion they focused role public private economic development mitigation adaptation 
422,1_egypt_climate_crisis_russia,kicks egypt hearing lots calls action weve calling action nearly years delegates urge go sea put heads water see whats stake 
423,2_sheikh_sharm_el_summit,'s pleasure attend met cop we ready amplify voices young people n't make sharm el sheikh 's time put things action 
424,-1_climate_minister_world_president,african countries need speak one voice make collective demands 's outline africa 's priorities sharm el sheikh 
425,-1_climate_minister_world_president,show us weak pmtail wagging dog
426,0_climate_must_change_world,new reports synthesis report report greenhouse gas bulletin world energy outlook navigating energy transitions
427,-1_climate_minister_world_president,might one morally bankrupt events recent historyrich elites war criminals fly private tourist enclave military dictatorship tell countries reduce consumptionthe good news see right
428,2_sheikh_sharm_el_summit,uae president hh sheikh mohamed bin zayed meets world leaders including israeli president h e british pm
429,-1_climate_minister_world_president,live watch press conference un climate change executive secretary cop president sameh shoukry 
430,-1_climate_minister_world_president,wondering cost send contingent lets talk accountability property taxes going next years 
431,2_sheikh_sharm_el_summit,sharm el sheikh implementation summit scis kick today pm gmt tune livestream 
432,0_climate_must_change_world,implementation focal point years roundtable discussion food security '' brought together climate experts break ways must actively carry on ground action relation building resilient agriculture systems 
433,-1_climate_minister_world_president,historic floods pakistan killed people rain usual pakistan produces less global carbon emissions one countries vulnerable climate crisis many 'historics ' 
434,2_sheikh_sharm_el_summit,photos president egypt global climate change conference met kenyan counterpart william ruto sunday 
435,1_egypt_climate_crisis_russia,distraction egypt frontlines climate crisis heatwaves sea level rise without focus justice future one technical fixes expense livable environment egypt worlds majority 
436,4_cop_today_due_work,today pleasure meeting incredible team volunteers their operational support critical ensuring successful outcome without hard work cop would possible 
437,0_climate_must_change_world,africa change longer threat reality think effect climate change addressed well 
438,-1_climate_minister_world_president,coz got fight green war follow passion add voices contribute solving global community challenges the th united nations climate change conference starts nov nov sharm el sheikh egypt 
439,0_climate_must_change_world,climate conference kicks end week many journalists touch data facts reporting here key resources hopefully help understand global emissions energy climate
440,0_climate_must_change_world,eastern european activists confronted asked commissioner worrying new gas investments eu making urged fight renewable expansion instead making fossil deals fight fire fire 
441,0_climate_must_change_world,expand access clean affordable energy cut carbon emissions time 
442,-1_climate_minister_world_president,new generation sadc leadership 
443,0_climate_must_change_world,agroecology set principles practices enhances resilience sustainability food farming systems preserving social integrity 
444,-1_climate_minister_world_president,amazing see scotland represented world stage looking forward seeing scotland globally continue push climate action 
445,-1_climate_minister_world_president,going start selling maldives soon maldives water years ago according numpties sharm el sheikh
446,-1_climate_minister_world_president,approach served rwanda well citizens bordering national parks benefit facilities services financed sustainable tourism revenues president kagame one planet event hosted president france sidelines
447,2_sheikh_sharm_el_summit,glad meet first woman serve prime minister italy today sharm el sheikh first day 
448,0_climate_must_change_world,climate change already causing migration soon cause vastly weirdly ironic sunaks real purpose going bend macrons ear channel crossings 
449,0_climate_must_change_world,concentrate minds attendees like doubtful this need billion climate activists 
450,4_cop_today_due_work,invites attendees visit sgi gallery immersive exhibition connects action innovation investment if cop stop see ksas green transition unfolding eyes 
451,-1_climate_minister_world_president, new brief based approach addressing look like key demands outcomes intersection get english french spanish arabic 
452,3_alaa_strike_prison_water, cairo marks hrs without water months restricted calories strike week full hunger strike day water begins
453,0_climate_must_change_world,told 's enough rishi sunak attend global climate talks it 's time real action needs scrap new oil gas fields need massive push renewables nine times cheaper 
454,0_climate_must_change_world,five teenagers arrested whitehaven coals newcastle office demanding cease disist coal expansions young people fight protect future copping 
455,0_climate_must_change_world,adaptation heart 's reading adaptation gap report transition paris living planet report th assessment report accounts climate crisis state trends adaptation 
456,0_climate_must_change_world, world leaders committed halting reversing forest loss land degradation a new forests climate leaders ' partnership launched today designed deliver essential goal watch video find
457,0_climate_must_change_world,media serious climate change speak climate scientists researchers focus climate activists climate denialists far right using climate activists ' statements undermine threats climate change 
458,-1_climate_minister_world_president, first edition time deliver human rights degrees safeshameful ambition gapget copy also spanish 
459,-1_climate_minister_world_president,significant milestone at president kagame launched rwandas new green investment facility facility provide financial services quality green investments foster private sector led green growth 
460,1_egypt_climate_crisis_russia,way annual un climate negotiations egypt 
461,2_sheikh_sharm_el_summit, proud hosting regenerative finance event year tamuwa park regency resort sharm el sheikh 
462,0_climate_must_change_world,let see 've got right us uk potentially austerity measures placed us autumn budget yet sunak happy bung ms countries wtaf 's 'money ' coming 's priority 
463,-1_climate_minister_world_president,checked pakistan pavilion looking forward panel discussions especially focusing
464,-1_climate_minister_world_president,kicks today need renewed ambitionaccelerationsolidaritycommitments climate justice
465,0_climate_must_change_world,fight war fight climate change ca n't fight war climate change time 
466,1_egypt_climate_crisis_russia,ultimate feelgood token beach lowered buy tax recognition rep currently egypt there isnt team earth much planet info 
467,0_climate_must_change_world, radio panel talking the labour mp said important serious reparations ie agreed said pleased set loss damage fund rich countries blocked
468,4_cop_today_due_work,hasnt formally opened yet plenty hard work among parties agree agenda start conference right footalways joy work team especially brilliant deputy alison campbell 
469,-1_climate_minister_world_president,pakistan pavilion starts bang today one unsg visited speak climate impacts pm fm also visited 
470,0_climate_must_change_world,yep isnt mad nicola sturgeon susan aitken swan homeless people kids lining freezing street hot meal could eradicate outrage 
471,0_climate_must_change_world,head drought kenya means million kenyans food insecure state emergency children affected million livestock dead pregnant lactating mothers need aid elephants deadwe need 
472,0_climate_must_change_world,'re still way track cbut let 's lose sight massive progress 've made since paris pre paris agreement heading c warmingnow 's cor c pledges met
473,0_climate_must_change_world,witnessing devastating right climate inaction led us here thanking people far signed letter world leaders demanding climate justice loss damage finance facility letter 
474,0_climate_must_change_world,absolutely ragin asked couldnt zoom total rage face
475,-1_climate_minister_world_president,pleased meet new uk prime minister today discussed deepening nations ' excellent relations economic climate ventures also talked security challenges chiefly iranian nuclear program 
476,0_climate_must_change_world, call parties take urgent action bring greenhouse gas emissions comply paris agreement climate change wont wait single day us 
477,4_cop_today_due_work,touchdown job well done welcoming tired travelers near far finally ready connect inspiring passionate voices committed ways looking forward seeing friends
478,0_climate_must_change_world,planet crying ambitious climate action save future generations needs pave way speedy green transition adequate adaption plans turning mitigation targets actionwe running time avoiding climate catastrophe still within reach
479,0_climate_must_change_world,starts today it historic opportunity put front center climate change discussions we must make count people planet 
480,0_climate_must_change_world,yet oil industry brought humanity biggest delegation last year cop probably year maybe scientists biggest show cop eh 
481,0_climate_must_change_world,global mean sea level rise rate doubled since rose nearly mm since jan new record high rise continue threatening millions coastal dwellers followers 
482,-1_climate_minister_world_president,regimes critics able get many egyptians r vetted regime rampant surveillance speak extreme danger rights groups warn severe crackdown
483,-1_climate_minister_world_president,n't even want go hypocrite 
484,0_climate_must_change_world,laura kuenssberg opens asking afford tackle climate crisis '' either lazy journalism gb news lite dismissal way date midst climate crisis 
485,0_climate_must_change_world,sunak going boris johnson
486,0_climate_must_change_world,nicola sturgeon need person 
487,-1_climate_minister_world_president,happy fighting we win 
