,topic,document
159,0_climate_must_change_world,reminder climate emergency 
160,-1_climate_minister_world_president, time implementation procrastination lets get poor vulnerable countries financing mitigation adaptation loss damage lets make trade integral part ndcs w presidents pm
161,0_climate_must_change_world,must deliver concrete action loss damage caused climate crisis this matter trust developed developing countries for many countries question survival 
162,-1_climate_minister_world_president,buses fight climate change h t
163,0_climate_must_change_world, days go world comes together pursuit one common goal turning ambition urgent concrete effective climate action 
164,0_climate_must_change_world,international drought resilience alliance launched aims help countries cities communities better prepare respond alliance drive regional actions initiatives innovation technology
165,0_climate_must_change_world,moment world leaders regain momentum climate change move negotiation action together 
166,5_private_jets_cola_coca,outrageously worlds largest plastic polluter coca cola supporting sponsor '' big companies helping destroy climate crash ecosystems paying greenwash image cop read 
167,-1_climate_minister_world_president, adaptation met issue finance fulfilled continue lag behind room except move forward obtain objectives '' president sameh shoukry cop press conference 
168,0_climate_must_change_world,people scotland struggling eat heat homes sturgeons giving away million cash reparations make look good utterly outrageous 
169,2_sheikh_sharm_el_summit,great see another un climate summit time sharm el sheikh egypt looking forward seeing scotland continue push climate action globally 
170,3_alaa_strike_prison_water,selling tea reach never easy journey 
171,4_cop_today_due_work,ahead first minister reiterated dedication ensuring cop one action implementation open honest debate loss damage met new executive secretary
172,0_climate_must_change_world,developing countries fertile precipice largest economic transformation since industrial revolution governments need protect communities affected ensure sustainable development
173,1_egypt_climate_crisis_russia,expectations run high new jetp 's energy transition partnerships world leaders gather egypt save date join discussion bishop geoff davies hosted
174,0_climate_must_change_world,air breathe food eat water drink environment live climate change destruction natural habitats impact health means protecting nature
175,0_climate_must_change_world,official emoji live make sure use join conversation come together climate implementation action
176,0_climate_must_change_world,climate hoax even less momentum esg right nobody cares nobody believes ruling class house cards collapsing 
177,3_alaa_strike_prison_water,'m way brother british citizen begins water strike may last days family needs proof life noon every day 'm relieved 're working confirm alaa still alive day 
178,0_climate_must_change_world,thought said broke rishi getting money pledging 
179,-1_climate_minister_world_president,let 's fight together let 's win 
180,0_climate_must_change_world,days away sneak peek conference center world leaders delegations experts civil society youth across globe meet mobilize global 
181,0_climate_must_change_world,every fraction degree global warming matters delay option 
182,0_climate_must_change_world,first ever food systems pavilion represents enormous opportunity ensure health planets soil considered policymakers discussions say soil experts
183,3_alaa_strike_prison_water,man rare courage hope vision dying jail meets nearbyhow save british citizen egyptian gem neither egypt afford lose article today
184,0_climate_must_change_world,president forefront improving climate data transparency made france global leader climate risk disclosure great see today partner work continues 
185,-1_climate_minister_world_president,king charles hosted reception buckingham palace today ahead group included fashion designer stella mccartney
186,-1_climate_minister_world_president,honour meet inspiration one key voice climate justice global south sir prof today want climate justice act 
187,0_climate_must_change_world,takes place frontlines converging climate food energy health debt crises africa needs deliver five key areas drive action cut emissions crisis support framework fulfill glasgow promises global stocktake
188,2_sheikh_sharm_el_summit,pleased sharm el sheikh egypt first engagement h e president current chair in office discussed importance cop commonwealth countries explored strategies enhance climate finance access 
189,0_climate_must_change_world, destruction amazon accelerating almost point return '' lungs world destroyed eyes there planet b time waste 
190,5_private_jets_cola_coca,us climate envoy john kerry calls dramatic carbon cuts climate summit below completely unrelated photo nice private jet
191,-1_climate_minister_world_president, day go kick tomorrow gmt stay tuned updates 
192,-1_climate_minister_world_president,shameful forced attending britain leader fixing climate crisis reluctant follower 
193,0_climate_must_change_world,first time ever un climate negotiations finance made onto agenda historic moment small island nations raising issue years happened concerted push developing countries
194,0_climate_must_change_world,care fixing need change course pretending proper technological answer currently exists implemented lack willpower reckless misleading my essay
195,0_climate_must_change_world, longer wait cost '' agreed 
196,2_sheikh_sharm_el_summit,prime minister mohammad shahbaz sharif arrived sharm el sheikh egypt participate sharm el sheikh climate implementation summit ''
197,-1_climate_minister_world_president,civilisation finished looks like comes next thats come inmy new short film ashes written directed animation director martyn pick please watch rt 
198,-1_climate_minister_world_president,world tour continues holiday local councillor pal along ride expense 
199,3_alaa_strike_prison_water,sanaa way attend raise case many think risky move absolutely right choice water strike limited days save him the risk losing forever outweighs
200,0_climate_must_change_world, million children live south asia epicenter climate crisis witnessed record amount climate induced devastation as world leaders meet needs conference commitments 
201,0_climate_must_change_world,rishi u turning bad sign leadership comewe leader whose anchor drifts political winds
202,0_climate_must_change_world,global warming seen opportunity oil drilling according us cables published julian assange prosecuted including part plans carve arctic oil gold uranium extraction link 
203,4_cop_today_due_work,live pavilion join cop business delegation critical climate focused discussions action let 's pioneer possible full program 
204,2_sheikh_sharm_el_summit, days go world meets sharm el sheikh present future planet stake transformative action delayed 
205,0_climate_must_change_world,head must put people justice center addressing climate crisis must take care people must take care vulnerable communities must take care planet generations still come 
206,3_alaa_strike_prison_water,alaa abd el fattah democracy activist british citizen whos prison egypt years faced persecution psychological torture authorities egypt days away stood sister say govt must urgently act
207,-1_climate_minister_world_president,remember back wrote pink ink king charles non attendance reply 
208,0_climate_must_change_world,arrived safely ahead climate conference were proud lead nations climate change negotiations address one pressing existential threats mankind climate crisis 
209,3_alaa_strike_prison_water,barely started recommendations already adopted would seriously undermine integrity last night supervisory body finalised recommendations regarding removals '' things know outcome 
210,2_sheikh_sharm_el_summit,president abdel fattah el sisi un chief antonio guterres receive ethiopian prime minister abiy ahmed participates cop meetings sharm el sheikh 
211,-1_climate_minister_world_president, exit pakistan '' ab bolo patriots road 
212,-1_climate_minister_world_president,experts britain siberian climate 
213,3_alaa_strike_prison_water,gravely urgent alaa abd el fattah british citizen months labourhave pressed government secure release rishi sunak must use visit egypt bring alaa home 
214,0_climate_must_change_world,power image connecting dutch cultural heritage climate change sealevel rise urgency act limiting global warming climate adaptation image via
215,4_cop_today_due_work,morning formally opened brought cop presidency closei fully recognise scale challenge ahead remain hopeful know need time deliverread speech
216,0_climate_must_change_world,world leaders unite next days sobering reminder south asia one million children living region affected least one climate environmental hazard shock stress 
217,0_climate_must_change_world,'good news ' according 'loss damage ' claim proposal 'd suggest uk citizen hit c bn cuts public spending 
218,2_sheikh_sharm_el_summit,live world leaders gathering sharm el sheikhfor day world leaders summit 
219,0_climate_must_change_world,officially starts today work towards achieve unlock progress keep conversations going make sure world leaders know demand climate action empty promises 
220,0_climate_must_change_world, wraps successfully ahead year egyptian cop presidency delivers first ever youth led young future generations day co created hosting youth pavilion owned entirely young people 
221,-1_climate_minister_world_president,first minister chaired meeting environmental council yesterday bringing together international experts discuss issues affecting climate environment ahead council 
222,-1_climate_minister_world_president,fossil fuels taken planet less billion people billion co emissions slight warming made earth greener ever greens hate tells need know 
223,1_egypt_climate_crisis_russia,attended spain 'm attending egypt nothing change two changing are insects gone wildlife gone forest gonebreathing clean air become luxury 
224,0_climate_must_change_world,nicola sturgeon 's selfies already begun self regarding shallow politician scotland first minister 
225,0_climate_must_change_world,forests available cost effective solution is countries need mobilize funds gigaton reduction emissions protecting restoring info 
226,0_climate_must_change_world,good boris johnson interrupt holiday go carry holiday
227,-1_climate_minister_world_president,officially started agenda good start germanys toughest delegate picked job fighting hardest red lines accepting compromise safe future 
228,0_climate_must_change_world,looks like nicola sturgeon taken strategic adviser liz lloyd well the taxpayer bill carbon footprint lot bigger thought 
229,0_climate_must_change_world,taking place gives us high hopes african cop deliver significant progress implementable climate actions issues priority developing countries 
230,2_sheikh_sharm_el_summit,dates saudis flagship climate eventsheld sidelines announced middle east green initiative summit nov saudi green initiative forum nov 
231,0_climate_must_change_world,busiest person nicola sturgeon 's photographer 
232,0_climate_must_change_world,anyone heard queen nicola sturgeon getting 
233,4_cop_today_due_work,delighted arrival baby several us nurtured trying times past three years honor work inspiring group academics activists artists poets aabout pursuits india beyond 
234,2_sheikh_sharm_el_summit,made coral films shown sharm el sheikh yes ecosystems brink destruction also get save happens counts waiting 
235,1_egypt_climate_crisis_russia,pity actual environment secretary recently dismissed gathering people egypt doubt shell drinking permanent cup trying spin way one better 
236,0_climate_must_change_world,past years track th warmest extreme heatwaves drought devastating flooding affected millions cost billions year disastrous glacier melt negotiations must consider
237,2_sheikh_sharm_el_summit,delighted sharm el sheikh thank egypt hosting call cop lot work lets get going 
238,3_alaa_strike_prison_water,already round matter ends free horror sisi 's prisons us suffer great loss family world including egyptian british govs even n't see 
239,-1_climate_minister_world_president, when years old saw landslides killing many people due harsh weather conditions images disturbed allow rest something done changing climate suffered 
240,0_climate_must_change_world,rishi sunak delivering bn pledges nairobi kenya pakistan somalia goes 'officially ' become world 's piggy bank sunak 's ignoring voter base 
241,1_egypt_climate_crisis_russia,thrilled egypt following fossil fuels protests big pledges deforestation methane adaptation etccome say hello media zone
242,0_climate_must_change_world, days go world leaders negotiators experts members civil society youth across globe convene sharm el sheikh goal mobilizing global climate agenda 
243,5_private_jets_cola_coca, november november sharm el sheikh egypt sponsored coca cola worlds top plastic polluter produce billion throwaway plastic bottles year currently private jet hub global leaders showcase hypocrisy 
244,0_climate_must_change_world,seeing week thinking earth '' n't worry 've got covered 's quick breakdown everything need know 
245,1_egypt_climate_crisis_russia,im invited speak prestigious iim calcutta th november tedx event unfortunately cant make due egypt and also tedxabesec event abes engineering college ghaziabad th november im deeply regretted 
246,1_egypt_climate_crisis_russia,'ll hear egypts new fossil fuel projects pollution scandals mass evictions arrests surveillance locals climate summit rampant media censorship continued human rights crisis regimes jails
247,-1_climate_minister_world_president,foreign minister pakistan visited pakistan pavilion along pm secretary general says world must join hands climate justice 
248,0_climate_must_change_world,urged govt back global fossil fuels registry useless reply minister fails acknowledge govts already plan produce double fossil fuels consistent cnew oil gas wo n't solve
249,0_climate_must_change_world,pictures china parts yangtze worlds third largest river dried historic drought summer 're time wait 
250,-1_climate_minister_world_president,coming two weeks tweeting un talks hope tweets tell positive results scaled ambition fear frustration worries follow tweets want know goes
251,0_climate_must_change_world,approaches remember single important image watch try make electric cars 
252,0_climate_must_change_world,switzerland 's glaciers lost half total volume less century we 're time waste 
253,-1_climate_minister_world_president,prime minister also endorsed secretary generals call climate justice climate solidarity 
254,-1_climate_minister_world_president,begins hourfollow opening ceremony live
255,-1_climate_minister_world_president,kids courting arrest kids future respect love gratitude
256,0_climate_must_change_world,lets hope marks end influence climate diplomacy idiotic person 
257,-1_climate_minister_world_president,unconscionable uk still cop president breaks promise help climate vulnerable countries 
258,4_cop_today_due_work,go hotel debacle last night 've made conference centre i 'm two weeks share tips including horror hotel stories come say hi dms open 
259,0_climate_must_change_world,intriguing retweet 
260,-1_climate_minister_world_president,first minister today call world leaders deliver commitments made glasgow climate pact attends first full day climate conference egypt 
261,0_climate_must_change_world,finally arrived things energy transition fossil fuel phase next days
262,0_climate_must_change_world,know pollinators help minimize impact climate change food security diversity 
263,0_climate_must_change_world,youre going bring down the disruption end government ends new oil gas support us
264,0_climate_must_change_world,looking forward important discussion convened president kenya know done right ecosystem restoration works reduction critical tool accelerate implementation 
265,1_egypt_climate_crisis_russia,way annual un climate negotiations egypt remind global governments world isnt energy crisis fossil fuel crisis 
266,1_egypt_climate_crisis_russia,safely reached cairo egypt heading shortly sharm el sheikh city we call governments establish fund developing countries implement climate financing pledges 
267,3_alaa_strike_prison_water,sanaa made safely sharm elsheikh attend event tomorrow wt german climate convoy let 's hope makes safely prison well soonall ask end chapter family together safe
268,1_egypt_climate_crisis_russia,productive call egyptian foreign minister sameh shoukry underscored appreciation egypts climate leadership egypt prepares host commitment deepening u s egypt strategic partnership 
269,1_egypt_climate_crisis_russia,president arrives egypt hes proposing south american summit defense recovery amazon 
270,-1_climate_minister_world_president,beyond scotland lead example world leading climate targets global leader renewable energy first nation world launch climate justice fund watch explain scotland playing part world stage 
271,1_egypt_climate_crisis_russia,kerem going egypt talk climate change environment 
272,0_climate_must_change_world,need global climate leadership removing climate ministers cabinet delaying cumbria coal mine decision fossil fuel subsidies despite screeching u turn sunak climate leaderme
273,0_climate_must_change_world,hes going then hes either going believes save planet hes going boris 
274,4_cop_today_due_work,hey rashee sanook couple thoughts cop car pool public transport zoom facetime streamyard less planes less attendees less assistants assistants 
275,0_climate_must_change_world,moved us dangerously close irreversible tipping points 's time reverse course there planet b time waste 
276,0_climate_must_change_world,errrrso many smart humans going wonder solutions coming
277,1_egypt_climate_crisis_russia,highway climate hell foot still accelerator at climate conference egypt calls urgent 
278,0_climate_must_change_world,young people everywhere demanding action decision makers tackle climate emergency ahead youth climate advocates tell us means them their voices go unheard 
279,-1_climate_minister_world_president,planning schedule wanted let know posting events 'm participating live streamed watch anything know might let know 
280,0_climate_must_change_world,climate conference starts today im participating youth delegate it crucial cop delivers keeping target alive agrees phasing fossil fuels requires scale green financing ensure
281,1_egypt_climate_crisis_russia,president meets emmanuel macron egypt 
282,2_sheikh_sharm_el_summit,almost men summit 
283,0_climate_must_change_world,releasing report estimate countries rely unrealistic amount land based removal meet climate pledges bn ha land total equal global cropland full report tomorrow summary gt 
284,-1_climate_minister_world_president,'s officialloss damage agenda matters relating funding arrangements addressing loss damage '' 
285,0_climate_must_change_world,tomorrow address opening session resilience frontiers un climate summit n't miss speech speech carry silent tears millions innocent children world victims climate crisis 
286,0_climate_must_change_world,climate progress separated political rights protect habitable planet unless free fight greenwashing police state fascism march around world must forcefully resisted 
287,-1_climate_minister_world_president,defining crisis time saw world distracted making progress refocus regain momentum my message talking media sharm el sheikh today 
288,4_cop_today_due_work,simple passengers obligation deliver receive
289,0_climate_must_change_world,'wikileaks cables reveal us manipulated climate accord ' 
290,-1_climate_minister_world_president,dear world leaders invite visit health pavilion humanity moment swift protect lungs brains hearts overall health well being 
291,-1_climate_minister_world_president,king championed action sustainable future years today hes hosting reception buckingham palace ahead egypt guests expected discuss ways public private partnership help tackle climate change pa
292,4_cop_today_due_work, officially began today ceremonial opening taking place plenary morning already seen significant developments summary day one 
293,0_climate_must_change_world,'s menu ignoring fact goes hand hand mass trillions gallons water usage could always opt sea bass help contribute towards ocean dead zones 
294,-1_climate_minister_world_president,loss damage finally formally adopted plenary agenda item never allowed formally tabled kudos teams talks ensure common ground crucial first step
295,-1_climate_minister_world_president,impressions day photos conference flickr account
296,5_private_jets_cola_coca,every tinpot dictatorship whose citizens happily burn car tyres keep warm winter demanding billions western taxpayers climate reparations '' which receive spend diamond encrusted learjets you 're farmed 
297,0_climate_must_change_world,anti tories utterly lost marbles billion mini budget designed help brits get similarly annoyed billion international climate finance weve pledged rest world utter out of touch madness
298,0_climate_must_change_world,sunak giving bn pakistan somalia whilst getting george osborne jeremy hunt implement huge austerity britain dont think need tell timeline exactly think bullsh isnt funny anymore 
299,-1_climate_minister_world_president,pleased meet friend cooperation key face difficult challenges time standing common values protecting citizens energy crisis 
300,0_climate_must_change_world,nuclear energy place table world needs 
301,0_climate_must_change_world,boris johnson wanging climate change us plebs ill take opinions large pinch salt flew back london cop climate summit glasgow private jet go dinner private members club 
302,2_sheikh_sharm_el_summit,begins sharm el sheikh mary robinson explains world time empty words hollow pledges calls urgent 
303,-1_climate_minister_world_president,need go beyond deal elephant room senegal behalf least developed countries group 
304,3_alaa_strike_prison_water, undrr calls member states support vision take 
305,0_climate_must_change_world,monarch butterflies among north america 's iconic species populations already declined gt if nature goes taking us 
306,-1_climate_minister_world_president,new study estimates carbon footprint investments world 's richest billionaires spoiler alert 's big big 
307,3_alaa_strike_prison_water,egypt hosts lets forget estimated political prisoners held join calls release alaa abd el fattah hunger strike right also want shine light prison uk thread 
308,-1_climate_minister_world_president,good news belgium following denmark scotland wallonia allocating funds climate induced
309,0_climate_must_change_world,un climate change conference opened today key aim ensuring full implementation paris agreement central focus areas transformational shift implementation progress critical workstreams delivery transparency accountability
310,5_private_jets_cola_coca, countries agreed improve emissions cutting pledges time two dozen countries far done polluting talking shop many arrive private jets talk cutting co emissions hypocrisy 
311,-1_climate_minister_world_president,join tomorrow 's rwanda twitter space accelerating green investment rwanda jean claude iliboneye moderated angelique karekezi set reminder 
312,2_sheikh_sharm_el_summit,friendship italy jordan long standing roots cherish wish strengthen honored meet majesty king abdullah ii royal highness crown prince al hussein sidelines
313,-1_climate_minister_world_president,needs recognize loss damage experienced pakistan needs define clear roadmap deal said today joint press encounter
314,0_climate_must_change_world,takes brass neck tory politician attack fm going conference climate change world 's top priority chaotic said said maybe said yes 
315,-1_climate_minister_world_president,world leaders meeting egypt talk climate change parking jets burn jetfuel contribute climate crisis canadian liberals burnt million litres jetfuel last years say hypocrites
316,2_sheikh_sharm_el_summit,arrived sharm el sheikh conference centre afternoon well make address th conference parties climate change remains committed promoting encouraging economic activities climate smart 
317,-1_climate_minister_world_president,alert stories bloomberg green aka outside paywall nov service readers read coverage content free next weeks 
318,0_climate_must_change_world,hi made thank accreditationand supporting trip media engagement climateandmigration meaningful african youth engagement contact nrosekobusinge
319,0_climate_must_change_world,'m old enough remember boris johnson 's contribution cop 
320,2_sheikh_sharm_el_summit,arrived sharm el sheikh important days ahead many countries contribute least climate change bearing brunt impact leaders responsibility drive climate delivery sustainable future planet people alike 
321,0_climate_must_change_world,today launching climate change summary 
322,0_climate_must_change_world,climate change wont wait must act today countries around world meet increase efforts global climate action leading way aims make eu climate neutral 
323,0_climate_must_change_world,voices women girls must central climate negotiations must listen young people seen felt impacts climate change simon stiell executive secretary opening remarks
324,1_egypt_climate_crisis_russia,wonder someone attending tell egypts sisi called world end war russia invading ukraine russia ukraine crisis 
325,0_climate_must_change_world,tomorrow begin campaign speaking canada news uk urge world leaders take concrete climate action save future last hope us decide life death 
