,topic,document
0,5_private_jets_cola_coca,world 's elite arrived hundreds private jets lecture climate change sponsored coca cola 
1,4_cop_today_due_work,friends partners allies great meet today 
2,-1_climate_minister_world_president,point maybe ask women help 
3,0_climate_must_change_world,climate change ravage planet without urgent action rishi sunak
4,0_climate_must_change_world,warned global leaders highway climate hell foot accelerator our planet fast approaching tipping points make climate chaos irreversible we need urgent 
5,5_private_jets_cola_coca,rich people flying private jets un talks sponsored coca cola give fossil fuel industry huge seat table criminalizing climate activists way stop irreversible catastrophic fossil fueled global heating 
6,5_private_jets_cola_coca,cop sponsored coca cola worlds top plastic polluter produce billion throwaway plastic bottles year 
7,5_private_jets_cola_coca, private jets world leaders flying climate summit discuss reduce carbon emission
8,3_alaa_strike_prison_water,brother last glass water prison please keep story alive 's saved this afternoon 'm flying sharm civil society pass egyptian regime claims civic space exists 'll testing 
9,1_egypt_climate_crisis_russia,egypt attend
10,1_egypt_climate_crisis_russia,incoming reports polish journalists business leaders plying ukrainian national anthem phones whenever spot group russians un climate summit starting egypt the russians arent happy 
11,-1_climate_minister_world_president,dude lecturing carbon footprint
12,-1_climate_minister_world_president,finally also great see keeping conservative tradition regular u turns 
13,-1_climate_minister_world_president,oliver dowden 's claim pm personally committed '' climate action ludicrous shamed going plans huge new oil gas extraction failed meet financial pledges climate vulnerable countries removed climate ministers cabinet
14,0_climate_must_change_world,pm credibility urges others keep glasgow commitments govt hasnt met finance pledges hasnt raised ambition uk emission cuts continuing fossil fuel subsidies wont rule new coal greenlighting oil gas
15,0_climate_must_change_world,made dramatic u turn giving toss climate change forced pretend give toss climate change 
16,0_climate_must_change_world,rishi sunak trumpets plan investing renewables '' plan includes banning onshore wind blocks new solar farms windfall tax gigantic loophole continued climate wrecking fossil fuel investment 
17,-1_climate_minister_world_president,hypocrisy 
18,-1_climate_minister_world_president,say 
19,-1_climate_minister_world_president,climate crisis fight lives losing but one thing certain give sure lose so lets fight together and lets win 
20,-1_climate_minister_world_president,man last row pm country suffered recently due climate change 
21,-1_climate_minister_world_president,dragged kicking screaming showing real leadership required home abroad weak wobbly prime minister day trip 
22,-1_climate_minister_world_president,simple effective message pakistan pavilion 
23,0_climate_must_change_world,earth rishi sunak claim 's delivering '' leadership '' 've seen climate ministers booted cabinet swathe new oil gas licences failure rule cumbria coal mine flip flopping even attending
24,0_climate_must_change_world,demands urgent action everyone renewables solution climate energy crises let 's accelerate energy transition 
25,0_climate_must_change_world,ed milibands climate reparations shows people like left lost marbles 
26,1_egypt_climate_crisis_russia,case missed egypt lit khafre pyramid one three ancient pyramids giza date back years ahead 
27,-1_climate_minister_world_president,met fellow leaders african nations sidelines discuss bilateral regional issues continue work solidarity find african solutions africa 's problems strive resilient continent 
28,-1_climate_minister_world_president,world leaders prepare travel discuss climate change heres reminder joe biden arrived glasgow
29,0_climate_must_change_world,ever going get pm doesnt bow media leftist pressure weak
30,0_climate_must_change_world,humanity tipping point must achieve climate justice support poorest loss damage deliver systemic change global scale running time solidarity climate activists human rights defenders wait longer 
31,0_climate_must_change_world,held discussions leaders several countries bilateral strategic issues alongside also met leaders continental international organizations discuss issues mutual interest 
32,-1_climate_minister_world_president,uk prime minister rushed room aides middle launch forests partnership
33,0_climate_must_change_world,need loss damage finance facility need climate justice need action time running decision makers need step
34,1_egypt_climate_crisis_russia,yesterday minister affairs mlanie joly arrived egypt so far year 've flown million kilometres tell world canadians pollute much all leaders agree one solution higher taxes 
35,0_climate_must_change_world,breaking m blocked supporters stop oil climbed onto overhead gantries m multiple locations halting traffic demanding government halts new oil gas consents licences anything less death sentence 
36,4_cop_today_due_work,underway come humans lots time loose 
37,5_private_jets_cola_coca,cop many billionaires gon na land private jets lecture us consumption habits year 
38,-1_climate_minister_world_president,happy week one 
39,5_private_jets_cola_coca,told us wear masks socially distance yet held lavish parties they told us save planet yet travelled private jet motorcade told us play rules played set rules taking piss 
40,-1_climate_minister_world_president,united nations climate summit kicks today sharm el sheikh city egypt finally loss damage finance agenda adopted today seek compensation liabilities rich countries historical polluters it 's time 
41,0_climate_must_change_world,begins today climate world succeed fail one must make two weeks count 
42,0_climate_must_change_world,breaking uk prime minister rishi sunak rushed conference room aides ahead speech mysterious circumstances
43,-1_climate_minister_world_president,outcome would different attendance limited alive 
44,0_climate_must_change_world,last years track warmest record sea levels rising twice speed s we must answer planets distress signal ambitious credible must place must time 
45,0_climate_must_change_world,want turn uk green energy superpower accepted k donors fossil fuel connections said busy attend stopped climate minister attending cabinet 
46,0_climate_must_change_world,sunak earnestly tells great current prime minister last pm shows leading world debateyeah right thatll rather pair total frauds engaged ego wrestling sideshow 
47,0_climate_must_change_world,imagine live frightening possibility young people like yaala maldives paying highest price crisis making 
48,0_climate_must_change_world,deliberations world leaders shape future struggle climate change face today challenge century duty leave clean green environment coming generations vow succeed costs
49,1_egypt_climate_crisis_russia,way egypt 
50,-1_climate_minister_world_president,finally leave tomorrow egypt attend representing india voice millions children world urge world leaders deliver concrete climate action loss damage caused climate crisis 's time climate justice 
51,-1_climate_minister_world_president,duration ill something different account portal egypt currently covered epic police state controlled coca cola sponsored hill knowlton spun greenwashing 
52,0_climate_must_change_world,glad see sunak 's screeching u turn embarrassing mis step world stage let lesson climate leadership matters urgently needs increase uk ambition emission reduction targets pay owe global climate funds
53,0_climate_must_change_world,informed police highway authority yesterday would disrupted knew chose warn public sound familiar fire floods drought disruption climate chaos wont end must stop new oil gas 
54,0_climate_must_change_world,impacts climate change loss damage cause longer ignored must agree clear time bound roadmap reflective scale urgency challenge it 's moral imperative question solidarity climate justice
55,-1_climate_minister_world_president,climate change seen greatest challenge face man treated much bigger priority united kingdom king charles iii
56,0_climate_must_change_world,first time since adoption un climate convention parties agreed introduce funding agenda item climate conference 
57,5_private_jets_cola_coca,private jet motorcade travelling political leaders hypocritically virtue signal sponsored coca cola conveniently forgotten contributed environmental catastrophe billion covid masks pollute oceans 
58,0_climate_must_change_world,desperate hope world looking herea year ago today sir david attenborough addressed world leaders opening ceremony with less one week powerful words still ring true
59,1_egypt_climate_crisis_russia,polish journalist covering un climate summit egypt greets russians hotel restaurant patriotic ukrainian song loud slava ukraini 
60,-1_climate_minister_world_president,good first meeting prime minister margins face many common challenges tackling climate change energy transition russias war ukraine look forward constructive cooperation based agreements 
61,0_climate_must_change_world,must immediately end use fossil fuels build massive amounts solar wind electrify everything conserve find solutions last hard stuff planes cement stop cutting trees 
62,-1_climate_minister_world_president,evening sharm el sheikh president kagame held talks president dr william ruto kenya ahead two leaders discussed continued positive fruitful bilateral relationship kenya rwanda 
63,-1_climate_minister_world_president,consumption richest people global society global emissions emitted population global emissions population needs recognise climate justice richmust change
64,0_climate_must_change_world,thoughts questions first plan quickly ramping fossil fuel industry comes meeting 's failure 's bottom line fossil fuels cause ramping industry must core solutions package 
65,-1_climate_minister_world_president, countries almost entirely powered iceland paraguay norway costa rica solutions 
66,1_egypt_climate_crisis_russia,believe allowed answer cop questions today days egypt another sign climate wrecking pm get
67,0_climate_must_change_world,droughts heatwaves floods devastating impact food production the unfolding global food crisis stopped nations manage climate crisis at leaders must commit find climate solutions help stop prevent hunger 
68,0_climate_must_change_world,urgently need shared global goal nature like c goal already climate halting biodiversity loss enough say must 
69,-1_climate_minister_world_president,first minister met prime minister barbados ahead egypt scotland committed engaging barbados find new areas collaboration particularly energy addressing achieving 
70,4_cop_today_due_work,tomorrow opening send clear signal world leaders urgency demands things differently let us use cop find common ground reflect urgency actions 
71,-1_climate_minister_world_president,rspb calls attend egypt nature climate emergencies deeply intertwined need pm build legacy glasgow cop show global leadership needs positive advocate role nature solving global crisis 
72,-1_climate_minister_world_president,treating us like suckers 
73,0_climate_must_change_world,sunak 's multi billion giveaway stick throats red wall voters still waiting levelling '' money promised how sunak find billions clean energy '' third world working class voters ca n't even afford switch heating 
74,-1_climate_minister_world_president,rspb calls attend egypt nature climate emergencies deeply intertwined need pm build legacy glasgow cop show global leadership needs positive advocate role nature solving global crisis 
75,0_climate_must_change_world,last year asked world leaders open hearts entering cop negotiations many yet take climate crisis seriously at leaders must show care people open eyes realities climate inaction 
76,0_climate_must_change_world,droughts europe made hunger stones '' visible year stones used mark desperately low river levels would forecast famines one elbe river says see cry '' time wait 
77,4_cop_today_due_work,heading along half plane ive since cop missed bali india cops due maternity leave kids grown emissions due working
78,1_egypt_climate_crisis_russia,held egypt watershed humanity 's fight climate change global warming extreme climatic events pakistan horn africa year showcased globalisation climate change turning blind eye lethal effects criminal 
79,-1_climate_minister_world_president,elected president sameh shoukry addresses climate envoys delegates opening plenary 
80,0_climate_must_change_world, science clear hope limiting temperature rise degrees means achieving global net zero emissions degree goal life support machines rattling '' secretary general 
81,1_egypt_climate_crisis_russia,climate disasters already hurting countries communities economies next week start egypt present crucial opportunity leaders make meaningful progress climate promises must become global priority need 
82,0_climate_must_change_world,sunak lecturing leaders need couldnt even arsed attend boris johnson threatened upstage peak tory britain whole world see 
83,0_climate_must_change_world, climate change ravage planet without urgent action sunak sunak gives heated swimming pool downgrades two homes give spare practice preach ignore we together 
84,0_climate_must_change_world, 're joining family global leaders dev ' partners advance get details events 're hosting partners explore key climate issues incl partnerships youth climate justice 
85,0_climate_must_change_world,believe complete waste time money agree yes yes yes
86,-1_climate_minister_world_president,let king go 's actual opportunity present better side uk influence go lead 
87,4_cop_today_due_work,always pleasure meet friend h e today reviewed task rehabilitation thanked sg creating un inter agency team prepare comprehensive reconstruction plan empathetic leadership key addressing climate change 
88,0_climate_must_change_world,catastrophic climate disasters continue upend lives millions children south asia leaving desperately need support survive world leaders unite unicef calls ensure children centre climate decisions 
89,0_climate_must_change_world,oil natural gas playing ongoing role africas energy mix years come renewables expensive unreliable cant heavy lifting need drill gas make energy poverty history fighting climate change 
90,1_egypt_climate_crisis_russia,live egypt opening ceremony
91,0_climate_must_change_world,human alive antithesis spirit glasgow boris johnson 
92,0_climate_must_change_world,inconvenient truth 
93,0_climate_must_change_world,must put us back track cut emissionsboost climate resilience adaptationkeep promise climate financeaddress loss damage resulting climate crisis 
94,0_climate_must_change_world,boris johnson showing like david brent kept turning work sacked
95,-1_climate_minister_world_president,leave yesterday egypt due short funds im getting delayed im going travel way thousands kilometres india selling tea tell world leaders provide urgent climate finance save planetand future 
96,5_private_jets_cola_coca, world 's richest percent responsible estimated share global co emissionsif want reduce emissions maybe lockdown likes bill gates co good startdo lot virtue signalling
97,2_sheikh_sharm_el_summit,welcomes world leaders climate envoys delegates civil society around world years sharm el sheikh climate implementation summit action meets ambition 
98,0_climate_must_change_world,must place rebuild trust re establish ambition needed avoid driving planet climate cliff we need much faster bolder 
99,-1_climate_minister_world_president,lula becomes president brazil beating fascist far right bolsonaro triumph hope compassion ambition better future brazilians ahead great news global shared world
100,4_cop_today_due_work,opening plenary commenced election sameh shoukry cop president parties 
101,1_egypt_climate_crisis_russia,welcome egypt president president love rwanda
102,1_egypt_climate_crisis_russia,egypt lighting
103,2_sheikh_sharm_el_summit,met leading kenyan environmentalist founder championing climate action globally kenyathrough tree growing addressed world leaders cop address sharm el sheikh egypt viva 
104,0_climate_must_change_world,rishi sunak attending govt lift ridiculous ban king charles attending 
105,0_climate_must_change_world,indigo rumblelow spokespersonfor stop oil london said expect government complicit illegal unconstitutionalplan issue licences consents new oil gas plan take world c
106,0_climate_must_change_world, rife disasters impacting youth across join conversation share first hand encounters
107,0_climate_must_change_world, humanity choice cooperate perish speaking world leaders summit un secretary general called historic pact developed emerging economies '' avoid runaway 
108,0_climate_must_change_world,face many challenges climate change biggest this implementation summit keep track promises we need everything keep degrees reach europe stays course 
109,0_climate_must_change_world,hardly major new package '' rishi sunak 's rehashing bn already committed glasgow 's finance m missing owe adaptation funds creative accounting wo n't solve
110,-1_climate_minister_world_president,holding people account presidents prime ministers ceos our policies businesses infrastructure actions must align my signal change today opening 
111,-1_climate_minister_world_president,still chance rapidly losing id say c intensive care either act immediately strong way lost probably lost ever spot huge amount stake
112,0_climate_must_change_world,must deliver massive emissions reductions money loss damage social justiceas negotiations failed last years carbon dioxide levels still going causing rising global temperatures c rising
113,0_climate_must_change_world,'s gov't one world 's ambitious green plans reduction target enshrined law we need industrialzed nations raise level ambition 's next 
114,5_private_jets_cola_coca,n't flown plane since see clearly every flight makes earth irreversibly hotter everything means way 'd fly corporate greenwash fest like cop must prove 's serious ending fossil fuel industry 's 
115,0_climate_must_change_world,exactly scotland 's first minister defends decision go despite receiving criticism back home fc
116,2_sheikh_sharm_el_summit,delighted meet friend uae president hh sheikh today discussed israeli emirati cooperation climate issues regional developments middle east 
117,0_climate_must_change_world,postponed days race set donald 's ambition raise awareness fragility worldwide one keys improving climate environment beneath feet 
118,0_climate_must_change_world,rishi sunak wrong attend agree yes yes yes
119,-1_climate_minister_world_president,today president kagame launched ireme invest rwandas green investment facility raised million first capitalization facility invest private sector led green growth rwanda availing sustainable finance 
120,0_climate_must_change_world,premint promob o g o f first get free nft airdrop public mintprice ethmint trees planted per nft million tree planting initiative
121,5_private_jets_cola_coca,multiple homes multiple cars private jets helicopters etcthe hypocrisy preaching us astounding the event soundbites virtue signalling political dodgy dealings masked climate support the average brit sick 
122,-1_climate_minister_world_president,asked years old girl carbon emissions fly attend ever ask modi ji travel attend cops free trip result hard work sweats last years atleast offset carbon footprints 
123,1_egypt_climate_crisis_russia,always pleasure joining time egypt discussed climate loss damage flooding pakistan effects russia ukrainian crisis attack former pm thread
124,1_egypt_climate_crisis_russia, registered egypt climate talks private jets thousands vehicles message today hold citizens accountable climate change make better unbelievable touch fact people choose heat eat 
125,0_climate_must_change_world,rishi sunaks dithering nearly left us empty chaired world stage doesnt get it real leadership would safeguard britains industrial future energy security new jobs valuable exports cutting bills good 
126,1_egypt_climate_crisis_russia,egyptian foreign minister sameh shoukry officially receives cop presidency former president
127,-1_climate_minister_world_president,way becoming global value chain ready demonstrate capabilities world join mr chairman 
128,0_climate_must_change_world,message uk pm today end finance new fossil fuels massively scale investments renewables call fund help communities cope devastating impacts climate crisis 
129,1_egypt_climate_crisis_russia, country built pyramids '' barbados pm mia mottley slams inaction climate crisis 
130,0_climate_must_change_world,important rishi sunak fucked early meeting 
131,-1_climate_minister_world_president,worlds biggest carbon polluters country annually metric tons 
132,4_cop_today_due_work,world leaders gather kicks today world watching calling cop acts commitments developing nations demanding previous commitments finance upheld read
133,0_climate_must_change_world,boris johnson going isnt minister charge brief hes already holiday speaking engagements backbench mp therefore working contingency matters whip withdrawn 
134,2_sheikh_sharm_el_summit,dave angel eco warrior breakfast delegates hotel
135,3_alaa_strike_prison_water,'s likely unless freed one prominent voices arab spring british egyptian die prison world leaders including biden egypt brutal imprisonment almost decade he n't even get consular visit 
136,2_sheikh_sharm_el_summit,special way sharm el sheikh take opportunity thank president appointing ps national treasury honor privilege serve position among m equally deserving kenyans
137,0_climate_must_change_world,julian assange faces year sentence extradited truthful reporting including ways powerful nations undermined climate actionprosecuting assange puts everyone 's right know peril
138,0_climate_must_change_world,surely reject idea britain paying 'climate reparations ' poorer countries would compensation calculated would police way cash spent labour backing tories
139,3_alaa_strike_prison_water,alaa drank last cup tea prison starting today 's zero calorie strike days starts cease consuming water well alaa bluffing 's fueled hope reunited us rage years stolen life 
140,0_climate_must_change_world,great first day world leaders summit part continued leadership announced triple funding adaptation today launched forests climate leaders partnership
141,0_climate_must_change_world,soil organic carbon treasure beneath feet potential sequester greenhouse gases help mitigate adapt learn relationship soils carbon
142,3_alaa_strike_prison_water,received letter pm pledging call release alaa highest levels '' end unacceptable treatment alaa drunk last glass water hrs ago let 's hope letter translates action
143,0_climate_must_change_world,every moment allow climate change ravage planet see human sufferingbecause act today risk leaving ever desperate inheritance children rishi sunak butrishi sunak may 
144,-1_climate_minister_world_president,happy meet team eu negotiators working hard next weeks make headway calling partners turn ambition action bring world line paris goal thank dedication wish every success 
145,0_climate_must_change_world,believe uk leading role play world tackles climate change role dragged kicking screaming taking action 
146,2_sheikh_sharm_el_summit,today opening ceremony sharm el sheikh climate implementation summit world leaders envoys delegates members civil society came together unified front mobilize prioritize global climate agenda 
147,-1_climate_minister_world_president,president kagame also commonwealth chair in office also met commonwealth sg ahead secretary general briefed president progress made goals set commonwealth countries chogm hosted kigali earlier year 
148,2_sheikh_sharm_el_summit,message delegates attending sharm el sheikh best snorkelling house reef park regency hotel na'ama bay 're welcome 
149,1_egypt_climate_crisis_russia,important two weeks ahead egypt must implement historic push future planet depends
150,5_private_jets_cola_coca,begins annual taxpayer funded jamboree world leaders fly private jets halfway around worldlike modern day king canutes shout stop forces controllike kings make poor poorer return lives luxury
151,2_sheikh_sharm_el_summit, november sharm el sheikh implementation summit provide platform highest level view creating much needed political momentum unity around difficult moment globe 
152,0_climate_must_change_world,critical work together set achieve targets limit global warming c looking forward increasing climate ambition partnering innovative solutions climate crisis prosperous future 
153,0_climate_must_change_world,new analysiswho responsible bn cilmate finance target missed us bn short fair share '' based historical emissions new analysis findsuk australia canada also bns short 
154,3_alaa_strike_prison_water, days hunger strike alaa abdel fattah die midst crime '' sharing facebook post torture make mockery climate talks power stop intervene
155,1_egypt_climate_crisis_russia,live president egypt urges world move concrete actions effective implementation climate also launches appeal end war russia ukraine 
156,-1_climate_minister_world_president, first minister met pakistans minister climate change they discussed devastating recent floods pakistan action loss damage 
157,3_alaa_strike_prison_water,brothers life danger need proof still alive noon every day enough confirm still alive speak sisi 
158,0_climate_must_change_world,president kagame addressed terra carta action forum breakfast organized ahead launched king charles iii terra carta sets practical action help private sector accelerate progress towards sustainable future 
